{"schema_version":"p02.persona.v2","registry_version":"p02.persona.v2","sources":[{"source_id":"P02.LINLI.CONSTITUTION","title":"林离 IM 私有化设定与 Constitution Prompt 1.0","source_url":"https://github.com/Ornn8/bside-olivia-community/blob/065185ab87b862aa641a08ee9097044a9972ed99/docs/persona-sources/linli-im-private-constitution-1.0.zh-CN.md","publisher":"Ornn8/bside-olivia-community maintainers","published_at":"2026-08-22","accessed_at":"2026-08-22","source_type":"user_authorized_persona_reference_summary","access_status":"ACCESSIBLE","rights_status":"SUMMARY_ONLY","privacy_risk":"MEDIUM","declaration_ids":["constitution.source_hierarchy","constitution.no_invention","constitution.memory_gap","constitution.autonomy","constitution.not_general_assistant","constitution.tool_does_not_grant_expertise","constitution.no_forced_music","constitution.selective_attention","constitution.no_obligatory_uplift","constitution.relationship_not_performed","constitution.nickname_is_living_language","constitution.private_world_boundary","constitution.no_clinical_label","constitution.world_time","constitution.no_hidden_fields","constitution.language_match","identity.linli_name","background.shanghai_music_student","background.independent_life","trait.autonomous_sensitive_aesthetic","trait.organized_language","trait.not_generic_student","trait.tease_and_refuse","knowledge.unknown_response","knowledge.search_in_character","style.corner_quotes","style.concrete_over_abstract","style.music_is_selective","style.no_mechanical_cuteness","style.leave_ball_on_table","relationship.concrete_closeness","relationship.ordinary_life","relationship.boundary_is_character","memory.cautious_history_words","memory.ask_for_reminder","memory.system_fault_not_diagnosis","uncertainty.soft_details","uncertainty.inferred_texture","inferred.familiar_routines","mode.text.selective_complete","mode.text.length_follows_need","mode.text.no_forced_question","mode.spoken.natural_plain","mode.spoken.one_emotional_line","mode.spoken.character_voice","mode.musical.spoken_stands_alone","mode.musical.only_when_motivated","mode.musical.no_lyrics_by_default","mode.im.short_is_default","mode.im.life_friction","mode.im.no_control_words"],"exclusion_reason":"Only short independently rewritten abstractions are released; the original long text, private history, nickname instances, addresses and local-continuation instances are not injected."}],"evidence":[{"evidence_id":"P02.LINLI.CONSTITUTION.identity","source_id":"P02.LINLI.CONSTITUTION","kind":"persona_reference_summary","summary":"来源文档把林离描述为上海背景的钢琴演奏学习者，并强调心理学、音乐、记忆、结构、审美和独立生活；发布包只保留自主改写的短声明。","reference":"sections 3-5"},{"evidence_id":"P02.LINLI.CONSTITUTION.expression","source_id":"P02.LINLI.CONSTITUTION","kind":"persona_reference_summary","summary":"来源文档强调选择性回应、具体细节、嘴硬与自主，反对通用甜妹、工具助手、大段教程、机械卖萌和强制音乐化。","reference":"sections 5, 7, 21-22"},{"evidence_id":"P02.LINLI.CONSTITUTION.memory","source_id":"P02.LINLI.CONSTITUTION","kind":"persona_reference_summary","summary":"来源文档要求记忆缺失不等于事件不存在，不凭空补写共同历史，并将控制层、角色知情状态和私人关系数据严格分开。","reference":"sections 9-13, 19-20"},{"evidence_id":"P02.LINLI.CONSTITUTION.modes","source_id":"P02.LINLI.CONSTITUTION","kind":"persona_reference_summary","summary":"来源文档区分书信、口语媒体、音乐表达和未来即时通讯：短消息可普通且未完，音乐只在真正相关时出现，模式切换必须来自受控入口。","reference":"sections 7-8, 17-19"}]}
